{
  "format": "xm-audio-studio.profiles",
  "version": 1,
  "exportedAt": "2026-10-21T12:00:00Z",
  "profiles": [
    {
      "id": "6f1c2d1e-3a4b-4c5d-8e9f-0a1b2c3d4e5f",
      "name": "Mi curva",
      "category": "user",
      "model": "wh-1000xm6",
      "deviceEq": {
        "steps": [
          1,
          1,
          0,
          0,
          0,
          0,
          1,
          2,
          1,
          0
        ]
      },
      "createdAt": "2026-10-21T11:00:00Z",
      "updatedAt": "2026-10-21T11:30:00Z"
    },
    {
      "id": "0b9e5a4c-2d1f-4e3a-9b8c-7d6e5f4a3b2c",
      "name": "AutoEq (sintético de ejemplo)",
      "category": "measured",
      "model": "wh-1000xm6",
      "deviceEq": {
        "steps": [
          2,
          2,
          -1,
          -1,
          -2,
          -1,
          -3,
          -4,
          -1,
          2
        ]
      },
      "sourceCurve": {
        "preampDb": -4.0,
        "filters": [
          {
            "type": "lowShelf",
            "frequency": 105.0,
            "gainDb": 4.0,
            "q": 0.7
          },
          {
            "type": "peaking",
            "frequency": 3000.0,
            "gainDb": -3.0,
            "q": 1.2
          },
          {
            "type": "highShelf",
            "frequency": 10000.0,
            "gainDb": 3.0,
            "q": 0.7
          }
        ]
      },
      "source": {
        "description": "Perfil sintético de prueba (no es una medición real)",
        "attribution": "XM Audio Studio"
      },
      "createdAt": "2026-10-21T11:00:00Z",
      "updatedAt": "2026-10-21T11:00:00Z"
    }
  ]
}
